[
  {
    "id": "verse-001",
    "title": "decides APIは角括弧呼び出し必須",
    "category": "language_constraint",
    "tags": [
      "decides",
      "GetValue",
      "SetValue",
      "syntax"
    ],
    "trigger": {
      "description": "stat系APIを呼ぶとき",
      "keywords": [
        "decides",
        "GetValue",
        "SetValue"
      ],
      "code_patterns": [
        "X.GetValue(...)",
        "X.SetValue(...)",
        "X.GetValue[...]"
      ]
    },
    "problem": {
      "summary": "丸括弧呼び出しで文法/評価が崩れる。",
      "common_ai_mistake": "Api(...) で記述する。"
    },
    "solution": {
      "summary": "decidesは [] で呼ぶ。",
      "code_example": "if (Cur := Stat.GetValue[Agent]):\n    if (Stat.SetValue[Agent, Cur + 1]):\n        0",
      "reference_url": "https://verselang.github.io/book/13_effects/"
    },
    "verification": {
      "status": "verified",
      "verified_by": "taichi",
      "verified_date": "2026-03頃",
      "uefn_version": "不明"
    },
    "severity": "critical",
    "related_ids": [
      "verse-017",
      "verse-042",
      "verse-068",
      "verse-070",
      "verse-071",
      "verse-075"
    ],
    "manifest_section": "3.1"
  },
  {
    "id": "verse-002",
    "title": "creative_device varはラウンド再初期化前提",
    "category": "device_behavior",
    "tags": [
      "round",
      "state",
      "creative_device"
    ],
    "trigger": {
      "description": "ラウンド跨ぎ状態を扱うとき",
      "keywords": [
        "OnBegin",
        "再初期化"
      ],
      "code_patterns": [
        "var X",
        "OnBegin<override>()"
      ]
    },
    "problem": {
      "summary": "クラスvar依存で状態が消える。",
      "common_ai_mistake": "ラウンド跨ぎで同じインスタンス状態が残る前提で書く。"
    },
    "solution": {
      "summary": "毎ラウンド再初期化/再購読し、永続はweak_mapへ分離する。",
      "code_example": "OnBegin<override>()<suspends> : void =\n    RegisterListeners()",
      "reference_url": "https://verselang.github.io/book/05_mutability/"
    },
    "verification": {
      "status": "verified",
      "verified_by": "taichi",
      "verified_date": "2026-03頃",
      "uefn_version": "不明"
    },
    "severity": "warning",
    "related_ids": [
      "verse-003",
      "verse-026"
    ],
    "manifest_section": "4.1"
  },
  {
    "id": "verse-003",
    "title": "永続はweak_map(player,persistable)に集約",
    "category": "pattern_recommended",
    "tags": [
      "weak_map",
      "persistable",
      "persistence"
    ],
    "trigger": {
      "description": "得点/進行度をラウンド跨ぎ保持したいとき",
      "keywords": [
        "weak_map",
        "persistable"
      ],
      "code_patterns": [
        "class<final><persistable>",
        "weak_map(player, ...)"
      ]
    },
    "problem": {
      "summary": "通常var/mapでは保持できない。",
      "common_ai_mistake": "通常mapを永続用途に使う。"
    },
    "solution": {
      "summary": "persistableレコードに集約してweak_mapで保持する。",
      "code_example": "data := class<final><persistable>:\n    Total : int = 0\n    CompletedRound : int = 0",
      "reference_url": "https://verselang.github.io/book/17_persistable/"
    },
    "verification": {
      "status": "verified",
      "verified_by": "taichi",
      "verified_date": "2026-03頃",
      "uefn_version": "不明"
    },
    "severity": "critical",
    "related_ids": [
      "verse-004",
      "verse-007",
      "verse-002",
      "verse-013",
      "verse-069"
    ],
    "manifest_section": "4.1"
  },
  {
    "id": "verse-004",
    "title": "player弱マップ上限を見越して設計集約",
    "category": "api_gotcha",
    "tags": [
      "weak_map",
      "limit",
      "design"
    ],
    "trigger": {
      "description": "playerキー永続マップを増やすとき",
      "keywords": [
        "weak_map上限"
      ],
      "code_patterns": [
        "weak_map(player,"
      ]
    },
    "problem": {
      "summary": "乱立で制約に当たりやすい。",
      "common_ai_mistake": "用途ごとにweak_mapを追加。"
    },
    "solution": {
      "summary": "1レコードに必要項目を集約する。 Epic 公式（Map in Verse / Verse Persistence Best Practices）では、モジュールスコープの weak_map と persistable に関する型・運用の指針が示される一方、「プロジェクト内で weak_map(player, …) を何個まで宣言できるか」という数値上限は、少なくとも当該ページ群では確認できなかった。本レコードの「乱立を避けて1レコードに集約する」は、永続データの整合性と保守性のための推奨パターンである。数値の「最大2つ」は実装コメント由来のため、公式ドキュメントで再確認できる根拠が得られたら verification を更新する。",
      "code_example": "TycoonPersistedData{ Gold, CurseMaxHP, TotalWins, ... }",
      "reference_url": "https://dev.epicgames.com/documentation/en-us/uefn/map-in-verse"
    },
    "verification": {
      "status": "verified",
      "verified_by": "taichi",
      "verified_date": "2026-03〜04頃（公式ドキュメント + Verse.digest 照合）。「weak_map 最大2個」はプロジェクト内コメント由来で公式未確認。",
      "uefn_version": "不明"
    },
    "severity": "critical",
    "related_ids": [
      "verse-003"
    ],
    "manifest_section": "4.1"
  },
  {
    "id": "verse-005",
    "title": "Eliminationイベント順序は非保証前提",
    "category": "api_gotcha",
    "tags": [
      "elimination_manager",
      "event_order",
      "race"
    ],
    "trigger": {
      "description": "キル点と終端処理を同時実装するとき",
      "keywords": [
        "EliminatedEvent",
        "EliminationEvent"
      ],
      "code_patterns": [
        "Subscribe(OnPlayerEliminated)",
        "Subscribe(OnPlayerElimination)"
      ]
    },
    "problem": {
      "summary": "順序依存だと加点/終端の取りこぼしが出る。",
      "common_ai_mistake": "発火順を固定とみなす。"
    },
    "solution": {
      "summary": "終端処理をsuspends化し短待機でレース耐性を持たせる。",
      "code_example": "Sleep(0.2)\n# then end-round",
      "reference_url": null
    },
    "verification": {
      "status": "verified",
      "verified_by": "taichi",
      "verified_date": "2026-03頃",
      "uefn_version": "不明"
    },
    "severity": "warning",
    "related_ids": [
      "verse-009",
      "verse-032",
      "verse-041"
    ],
    "manifest_section": "5.2"
  },
  {
    "id": "verse-006",
    "title": "OnBegin直後stat操作は待機後に行う",
    "category": "api_gotcha",
    "tags": [
      "OnBegin",
      "stat_creator",
      "Sleep"
    ],
    "trigger": {
      "description": "開始直後にstat復元/初期化するとき",
      "keywords": [
        "OnBegin",
        "SetValue"
      ],
      "code_patterns": [
        "OnBegin<override>()<suspends>",
        "Sleep(0.5)"
      ]
    },
    "problem": {
      "summary": "初期化競合で反映漏れが起きる。",
      "common_ai_mistake": "待機なしでSetValueする。"
    },
    "solution": {
      "summary": "短待機後に復元/初期化する。",
      "code_example": "Sleep(0.5)\nPlayerPoints.SetValue[...]",
      "reference_url": null
    },
    "verification": {
      "status": "verified",
      "verified_by": "taichi",
      "verified_date": "2026-03頃",
      "uefn_version": "不明"
    },
    "severity": "warning",
    "related_ids": [
      "verse-007",
      "verse-015"
    ],
    "manifest_section": "E"
  },
  {
    "id": "verse-007",
    "title": "新マッチ判定はCompletedRound×TotalRounds",
    "category": "pattern_recommended",
    "tags": [
      "IsNewMatch",
      "CompletedRound",
      "TotalRounds"
    ],
    "trigger": {
      "description": "新規だけ初期化し継続ラウンドを復元したいとき",
      "keywords": [
        "IsNewMatch",
        "CompletedRound"
      ],
      "code_patterns": [
        "if (IsNewMatch = true)",
        "ST.CompletedRound < TotalRounds"
      ]
    },
    "problem": {
      "summary": "判定不備で毎ラウンド0化する。",
      "common_ai_mistake": "OnBegin毎に常時リセット。"
    },
    "solution": {
      "summary": "進行度に応じてnew/continue分岐する。",
      "code_example": "if (IsNewMatch = true):\n    # zero\nelse:\n    # restore",
      "reference_url": null
    },
    "verification": {
      "status": "verified",
      "verified_by": "taichi",
      "verified_date": "2026-03頃",
      "uefn_version": "不明"
    },
    "severity": "critical",
    "related_ids": [
      "verse-008",
      "verse-011",
      "verse-003",
      "verse-006"
    ],
    "manifest_section": "6"
  },
  {
    "id": "verse-008",
    "title": "PersistTotalでCompletedRoundを増やさない",
    "category": "pattern_antipattern",
    "tags": [
      "PersistTotal",
      "CompletedRound",
      "double_count"
    ],
    "trigger": {
      "description": "得点保存と進行更新を同関数で書きたくなるとき",
      "keywords": [
        "PersistTotal",
        "二重加算"
      ],
      "code_patterns": [
        "PersistTotal(...)",
        "CompletedRound := ... + 1"
      ]
    },
    "problem": {
      "summary": "進行度が壊れて判定破綻する。",
      "common_ai_mistake": "保存関数内で進行度を更新。"
    },
    "solution": {
      "summary": "進行更新はラウンド終端一括にする。",
      "code_example": "PersistTotal: CompletedRound := SavedCompletedRound",
      "reference_url": null
    },
    "verification": {
      "status": "verified",
      "verified_by": "taichi",
      "verified_date": "2026-03頃",
      "uefn_version": "不明"
    },
    "severity": "critical",
    "related_ids": [
      "verse-007",
      "verse-010"
    ],
    "manifest_section": "4.2"
  },
  {
    "id": "verse-009",
    "title": "全員脱落分岐を明示してラウンド終端",
    "category": "pattern_recommended",
    "tags": [
      "all_eliminated",
      "no_survivor",
      "edge_case"
    ],
    "trigger": {
      "description": "1人テストや同時脱落を考慮した終端判定時",
      "keywords": [
        "EliminationCount",
        "TotalPlayersThisRound"
      ],
      "code_patterns": [
        "else if: EliminationCount >= TotalPlayersThisRound"
      ]
    },
    "problem": {
      "summary": "生存者前提のみだと終端しない。",
      "common_ai_mistake": "TotalPlayers-1条件のみ実装。"
    },
    "solution": {
      "summary": "全員脱落分岐でVRなし終端を追加する。",
      "code_example": "spawn { NoSurvivorRoundEnd(Eliminated) }",
      "reference_url": null
    },
    "verification": {
      "status": "verified",
      "verified_by": "taichi",
      "verified_date": "2026-03末",
      "uefn_version": "不明"
    },
    "severity": "critical",
    "related_ids": [
      "verse-010",
      "verse-011",
      "verse-005"
    ],
    "manifest_section": "6"
  },
  {
    "id": "verse-010",
    "title": "終端更新は加点成功依存にしない",
    "category": "pattern_recommended",
    "tags": [
      "end_round",
      "fault_tolerance",
      "SetValue"
    ],
    "trigger": {
      "description": "加点と終了を同ブロックで書くとき",
      "keywords": [
        "SetValue失敗",
        "EndGame"
      ],
      "code_patterns": [
        "if (SetValue[...]):",